no,age,gender,vaccinated_dates,vaccine_name,lot_no,manufacturer,concurrent_vaccination_flag,concurrent_vaccination,pre_existing_disease_names,PT_names,onset_dates,days_to_onset,causal_relationship,severity,gross_result_dates,gross_results,pt_by_expert,causal_relationship_by_expert,brighton_classification_by_expert,comments_by_expert
1,69歳,男,2024/10/12,コミナティ,不明,ファイザー,False,,透析、２型糖尿病、肝癌,感音性難聴,2024/10/17,5,評価不能,重い,不明,後遺症,感音性難聴,γ,-,ワクチン接種5日後に発症した感音性難聴であるが、現状の情報ではワクチン接種との因果関係の評価は困難である。
2,86歳,女,2024/10/21,コミナティ,LK7363,ファイザー,True,インフルエンザ;デンカ;755-B,脳出血、認知症、パーキンソニズム、てんかん,細菌感染,2024/10/22,1,評価不能,重い,不明,不明,,,,
3,87歳,女,2024/10/31,インフルエンザ 754-A,,デンカ,True,コミナティ;ファイザー;LL7260,糖尿病、高血圧、脂質異常症、脳梗塞,アナフィラキシー反応,2024/10/31,0,関連あり,重い,2024/10/31,回復,アナフィラキシー反応 γ,,4,基準は満たさないが、処置は適切と考える。
4,73歳,女,2024/11/27,コミナティ,LL7260,ファイザー,False,,脳出血、痙攣発作、高血圧、心房細動、慢性心不全、便秘、入院、ＣＯＶＩＤ－１９、免疫、寝たきり、脳梗塞,痙攣発作、疾患再発、酸素飽和度低下、発熱、頻脈,2024/11/28,1,関連あり,重い,不明,回復,,,,
5,82歳,女,2025/2/4,コミナティ,LL7309,ファイザー,False,,深部静脈血栓症、糖尿病、股関節形成、大静脈フィルター挿入、血小板減少症,ワクチン投与関連肩損傷、関節炎、肩回旋筋腱板症候群、関節滲出液,2025/2/6,2,関連あり,重い,不明,未回復,,,,
6,77歳,男,2025,コミナティ,不明,ファイザー,False,,薬物過敏症,末梢性ニューロパチー,2025,不明,関連あり,重い,不明,未回復,,,,
7,不明,女,不明,コミナティ,不明,ファイザー,False,,うつ病、不眠症、甲状腺機能低下症、高尿酸血症、脂質異常症のため他院にて治療中。2型糖尿病、頸動脈プラーク、高血圧、肝機能障害、浮腫、てんかん傾向、慢性腎臓病、多動性障害、膀胱炎にて当院治療・経過観察中。,COVID-19後遺症様症状,不明,不明,評価不能,重い,不明,未回復,,,,
